{
  "ok": true,
  "requestId": "execreq_01HZWXQ6V4KR2Y2XP9VJ6Y3Q7A",
  "status": {
    "state": "dispatched",
    "terminal": false,
    "mode": "relay_signed",
    "lane": "fast",
    "actorType": "anonymous_x402",
    "receivedAt": "2026-03-03T01:15:40.100Z",
    "updatedAt": "2026-03-03T01:15:41.100Z",
    "terminalAt": null,
    "queueDepth": 4,
    "queuePosition": 0
  },
  "events": [
    {
      "state": "received",
      "at": "2026-03-03T01:15:40.100Z"
    },
    {
      "state": "validated",
      "at": "2026-03-03T01:15:40.500Z"
    },
    {
      "state": "queued",
      "at": "2026-03-03T01:15:40.700Z",
      "attempt": 0,
      "note": "queued-behind-priority"
    },
    {
      "state": "dispatched",
      "at": "2026-03-03T01:15:41.100Z",
      "provider": "helius_sender",
      "attempt": 1
    }
  ],
  "attempts": [
    {
      "attempt": 1,
      "provider": "helius_sender",
      "state": "submitted",
      "at": "2026-03-03T01:15:41.100Z"
    }
  ]
}
